{
  "$schema": "https://json-schema.org/draft/2020-12/schema",
  "$id": "https://uap.dev/schemas/demand/campaign.json",
  "title": "Campaign",
  "name": "dev.uap.demand.campaign",
  "version": "2026-09-02",
  "description": "A buyer's top-level unit of spend: an objective, a budget, a flight, and the line items that execute it.",
  "$comment": "Mirrors the hierarchy every buying platform already exposes (account, campaign, ad group, ad; here advertiser, campaign, line item, creative) so that an agency's tooling maps onto it without a new mental model. The objective vocabulary matches what the market buys against: reach prices on CPM, clicks on CPC, conversions on CPA.",
  "type": "object",
  "additionalProperties": false,
  "required": ["campaign_id", "advertiser_id", "name", "objective", "budget", "status"],
  "properties": {
    "campaign_id": { "type": "string", "maxLength": 128 },
    "advertiser_id": { "type": "string", "maxLength": 256 },
    "name": { "type": "string", "maxLength": 200 },
    "objective": {
      "type": "string", "enum": ["reach", "clicks", "conversions", "sponsorship"],
      "$comment": "  reach         optimise impressions; buys on CPM; requires trust tier >= 1 supply\n  clicks        optimise valid clicks; buys on CPC\n  conversions   optimise reported conversions; buys on CPA; only objective open to tier 0 supply\n  sponsorship   untargeted, signal_class none; fixed placement on a surface"
    },
    "status": { "type": "string", "enum": ["draft", "active", "paused", "completed", "archived"] },
    "budget": {
      "type": "object", "additionalProperties": false, "required": ["total_micros", "currency"],
      "properties": {
        "total_micros": { "$ref": "../common/types/micros.json" },
        "daily_micros": { "$ref": "../common/types/micros.json" },
        "currency": { "$ref": "../common/types/currency.json" },
        "spend_mandate": {
          "type": "string", "maxLength": 512,
          "description": "Reference to the AP2 Intent Mandate authorising this spend.",
          "$comment": "SPEC.md §10.2. The mandate is scoped to campaign, budget ceiling and window, so the exchange can prove every cleared batch was authorised."
        }
      }
    },
    "flight": {
      "type": "object", "additionalProperties": false, "required": ["start_at"],
      "properties": {
        "start_at": { "type": "string", "format": "date-time" },
        "end_at": { "type": "string", "format": "date-time" }
      }
    },
    "supply": {
      "type": "object", "additionalProperties": false,
      "description": "Where this campaign may run.",
      "properties": {
        "min_trust_tier": { "type": "integer", "enum": [0, 1, 2], "default": 1 },
        "profiles": { "type": "array", "items": { "type": "string", "enum": ["uap.decision.local", "uap.decision.hosted", "uap.decision.hybrid"] } },
        "model_ids": { "type": "array", "maxItems": 64, "items": { "type": "string", "maxLength": 256 }, "description": "Allowlist of models whose turns this may run on. Absent means any model whose steward permits it." },
        "blocked_model_ids": { "type": "array", "maxItems": 64, "items": { "type": "string", "maxLength": 256 } },
        "sellers": { "type": "array", "maxItems": 256, "items": { "type": "string", "maxLength": 64 }, "description": "Allowlist of seller_ids from the exchange's uap-sellers.json." },
        "locales": { "type": "array", "maxItems": 64, "items": { "type": "string", "pattern": "^[a-z]{2}(-[A-Z]{2})?$" } },
        "geos": { "type": "array", "maxItems": 256, "items": { "type": "string", "pattern": "^[A-Z]{2}(-[A-Z0-9]{1,3})?$" } }
      }
    },
    "line_items": { "type": "array", "maxItems": 500, "items": { "$ref": "line_item.json" } },
    "labels": { "type": "object", "additionalProperties": { "type": "string", "maxLength": 128 }, "maxProperties": 32, "description": "Buyer-defined key/values for reporting breakdowns." },
    "created_at": { "type": "string", "format": "date-time" },
    "updated_at": { "type": "string", "format": "date-time" }
  }
}
