{
  "campaign_id": "cmp_2026q4_travel",
  "advertiser_id": "brand.acme.example",
  "name": "Q4 Japan autumn travel",
  "objective": "clicks",
  "status": "active",
  "budget": { "total_micros": 50000000000, "daily_micros": 800000000, "currency": "USD",
              "spend_mandate": "ap2:intent:01J9X2K4M7N8P0Q1R2S3T4U5V6" },
  "flight": { "start_at": "2026-10-01T00:00:00Z", "end_at": "2026-12-15T23:59:59Z" },
  "supply": { "min_trust_tier": 1, "profiles": ["uap.decision.local", "uap.decision.hosted"],
              "locales": ["en-US", "en-GB"], "geos": ["US", "GB"] },
  "labels": { "agency": "wpp", "brand_line": "leisure" },
  "line_items": [{
    "line_item_id": "li_991",
    "campaign_id": "cmp_2026q4_travel",
    "advertiser": { "id": "brand.acme.example", "display_name": "Acme Travel", "domain": "acme.example" },
    "status": "active",
    "targeting": { "all": [
      { "intent_any": ["travel.accommodation.hotel", "travel.destination.japan"] },
      { "commercial_intent_gte": 0.5 },
      { "not": { "intent_any": ["travel.insurance"] } } ] },
    "pricing": { "model": "cpc", "currency": "USD", "bid_cpc_micros": 900000, "bid_strategy": "maximize_clicks" },
    "pacing": { "budget_micros": 50000000000, "daily_cap_impressions": 200000, "smoothing": "even" },
    "frequency_cap": { "per_conversation": 1, "per_node_user_per_day": 2 },
    "flight": { "start_at": "2026-10-01T00:00:00Z", "end_at": "2026-12-15T23:59:59Z" },
    "categories": ["travel.accommodation"],
    "brand_safety": { "arms": "floor", "hate_speech": "floor", "debated_social_issue": "medium" },
    "creatives": [{
      "creative_id": "cr_884", "format": "sponsored_card",
      "content": { "headline": "Kyoto ryokan, free cancellation", "body": "Traditional inns from $180 a night, cancel up to 24h before.",
                   "brand_name": "Acme Travel",
                   "actions": [{ "type": "link", "label": "See rooms", "url": "https://acme.example/kyoto?uap_click={CLICK_ID}" }] },
      "disclosure": { "label": "Sponsored", "advertiser_name": "Acme Travel" },
      "categories": ["travel.accommodation"],
      "review": { "status": "approved", "reviewer": "uax.example.com", "policy_version": "2026-08-01" },
      "content_digest": "sha256:5b7e1f9c2a4d8e6b0c3f5a7d9e1b3c5f7a9d1e3b5c7f9a1d3e5b7c9f1a3d5e7b"
    }]
  }],
  "created_at": "2026-09-03T10:00:00Z", "updated_at": "2026-09-03T10:00:00Z"
}
